# tracer: mmiotrace
#
# entries-in-buffer/entries-written: 32536/55168   #P:1
#
#                                _-----=> irqs-off/BH-disabled
#                               / _----=> need-resched
#                              | / _---=> hardirq/softirq
#                              || / _--=> preempt-depth
#                              ||| / _-=> migrate-disable
#                              |||| /     delay
#           TASK-PID     CPU#  |||||  TIMESTAMP  FUNCTION
#              | |         |   |||||     |         |
R 2 298.823649 1 0xf7000000 0x0 0x0 0
R 2 298.823655 1 0xf7000000 0x0 0x0 0
R 2 298.823657 1 0xf7000000 0x0 0x0 0
R 2 298.823663 1 0xf7000000 0x0 0x0 0
R 2 298.823665 1 0xf7000004 0x8 0x0 0
R 2 298.823671 1 0xf7000004 0x6 0x0 0
R 2 298.823673 1 0xf7000004 0x5 0x0 0
R 4 298.823676 1 0xf7000004 0x8 0x0 0
R 2 298.823678 1 0xf7000008 0x9 0x0 0
R 2 298.823684 1 0xf7000008 0xA 0x0 0
R 2 298.823686 1 0xf7000008 0xB 0x0 0
R 2 298.823692 1 0xf7000008 0xC 0x0 0
R 2 298.823694 1 0xf700000C 0xD 0x0 0
R 2 298.823697 1 0xf700000C 0xE 0x0 0
R 2 298.823702 1 0xf700000C 0xF 0x0 0
R 2 298.823705 1 0xf700000C 0x10 0x0 0
R 2 298.823707 1 0xf7000010 0x11 0x0 0
R 2 298.823713 1 0xf7000010 0x12 0x0 0
R 4 298.823715 1 0xf7000010 0x13 0x0 0
R 2 298.823718 1 0xf7000010 0x14 0x0 0
R 2 298.823724 1 0xf7000014 0x15 0x0 0
R 2 298.823726 1 0xf7000014 0x16 0x0 0
R 2 298.823732 1 0xf7000014 0x17 0x0 0
R 2 298.823734 1 0xf7000014 0x18 0x0 0
R 2 298.823740 1 0xf7000018 0x19 0x0 0
R 4 298.823742 1 0xf7000018 0x1A 0x0 0
R 2 298.823748 1 0xf7000018 0x1B 0x0 0
R 2 298.823750 1 0xf7000018 0x1C 0x0 0
R 2 298.823756 1 0xf700001C 0x1D 0x0 0
R 4 298.823758 1 0xf700001C 0x1E 0x0 0
R 2 298.823764 1 0xf700001C 0x1F 0x0 0
R 2 298.823766 1 0xf700001C 0x20 0x0 0
R 2 298.823772 1 0xf7000020 0x21 0x0 0
R 4 298.823774 1 0xf7000020 0x22 0x0 0
R 2 298.823780 1 0xf7000020 0x23 0x0 0
R 2 298.823782 1 0xf7000020 0x24 0x0 0
R 2 298.823788 1 0xf7000024 0x25 0x0 0
R 4 298.823790 1 0xf7000024 0x26 0x0 0
R 2 298.823796 1 0xf7000024 0x27 0x0 0
R 2 298.823798 1 0xf7000024 0x28 0x0 0
W 2 298.823649 1 0xf7000000 0x0 0x0 0
W 2 298.823655 1 0xf7000000 0x0 0x0 0
W 2 298.823657 1 0xf7000000 0x0 0x0 0
W 2 298.823663 1 0xf7000000 0x0 0x0 0
W 2 298.823665 1 0xf7000004 0x5 0x0 0
W 2 298.823671 1 0xf7000004 0x6 0x0 0
W 2 298.823673 1 0xf7000004 0x7 0x0 0
W 4 298.823676 1 0xf7000004 0x8 0x0 0
W 2 298.823678 1 0xf7000008 0x9 0x0 0
W 2 298.823684 1 0xf7000008 0xA 0x0 0
W 2 298.823686 1 0xf7000008 0xB 0x0 0
W 2 298.823692 1 0xf7000008 0xC 0x0 0
W 2 298.823694 1 0xf700000C 0xD 0x0 0
W 2 298.823697 1 0xf700000C 0xE 0x0 0
W 2 298.823702 1 0xf700000C 0xF 0x0 0
W 2 298.823705 1 0xf700000C 0x10 0x0 0
W 2 298.823707 1 0xf7000010 0x11 0x0 0
W 2 298.823713 1 0xf7000010 0x12 0x0 0
W 4 298.823715 1 0xf7000010 0x13 0x0 0
W 2 298.823718 1 0xf7000010 0x14 0x0 0
W 2 298.823724 1 0xf7000014 0x15 0x0 0
W 2 298.823726 1 0xf7000014 0x16 0x0 0
W 2 298.823732 1 0xf7000014 0x17 0x0 0
W 2 298.823734 1 0xf7000014 0x18 0x0 0
W 2 298.823740 1 0xf7000018 0x19 0x0 0
W 4 298.823742 1 0xf7000018 0x1A 0x0 0
W 2 298.823748 1 0xf7000018 0x1B 0x0 0
W 2 298.823750 1 0xf7000018 0x1C 0x0 0
W 2 298.823756 1 0xf700001C 0x1D 0x0 0
W 4 298.823758 1 0xf700001C 0x1E 0x0 0
W 2 298.823764 1 0xf700001C 0x1F 0x0 0
W 2 298.823766 1 0xf700001C 0x20 0x0 0
W 2 298.823772 1 0xf7000020 0x21 0x0 0
W 4 298.823774 1 0xf7000020 0x22 0x0 0
W 2 298.823780 1 0xf7000020 0x23 0x0 0
W 2 298.823782 1 0xf7000020 0x24 0x0 0
W 2 298.823788 1 0xf7000024 0x25 0x0 0
W 4 298.823790 1 0xf7000024 0x26 0x0 0
W 2 298.823796 1 0xf7000024 0x27 0x0 0
W 2 298.823798 1 0xf7000024 0x28 0x0 0
R 2 298.823649 1 0xf7000000 0x0 0x0 0
R 2 298.823655 1 0xf7000000 0x0 0x0 0
R 2 298.823657 1 0xf7000000 0x0 0x0 0
R 2 298.823663 1 0xf7000000 0x0 0x0 0
R 2 298.823665 1 0xf7000004 0x5 0x0 0
R 2 298.823671 1 0xf7000004 0x6 0x0 0
R 2 298.823673 1 0xf7000004 0x7 0x0 0
R 4 298.823676 1 0xf7000004 0x8 0x0 0
R 2 298.823678 1 0xf7000008 0x9 0x0 0
R 2 298.823684 1 0xf7000008 0xA 0x0 0
R 2 298.823686 1 0xf7000008 0xB 0x0 0
R 2 298.823692 1 0xf7000008 0xC 0x0 0
R 2 298.823694 1 0xf700000C 0xD 0x0 0
R 2 298.823697 1 0xf700000C 0xE 0x0 0
R 2 298.823702 1 0xf700000C 0xF 0x0 0
R 2 298.823705 1 0xf700000C 0x10 0x0 0
R 2 298.823707 1 0xf7000010 0x11 0x0 0
R 2 298.823713 1 0xf7000010 0x12 0x0 0
R 4 298.823715 1 0xf7000010 0x13 0x0 0
R 2 298.823718 1 0xf7000010 0x14 0x0 0
R 2 298.823724 1 0xf7000014 0x15 0x0 0
R 2 298.823726 1 0xf7000014 0x16 0x0 0
R 2 298.823732 1 0xf7000014 0x17 0x0 0
R 2 298.823734 1 0xf7000014 0x18 0x0 0
R 2 298.823740 1 0xf7000018 0x19 0x0 0
R 4 298.823742 1 0xf7000018 0x1A 0x0 0
R 2 298.823748 1 0xf7000018 0x1B 0x0 0
R 2 298.823750 1 0xf7000018 0x1C 0x0 0
R 2 298.823756 1 0xf700001C 0x1D 0x0 0
R 4 298.823758 1 0xf700001C 0x1E 0x0 0
R 2 298.823764 1 0xf700001C 0x1F 0x0 0
R 2 298.823766 1 0xf700001C 0x20 0x0 0
R 2 298.823772 1 0xf7000020 0x21 0x0 0
R 4 298.823774 1 0xf7000020 0x22 0x0 0
R 2 298.823780 1 0xf7000020 0x23 0x0 0
R 2 298.823782 1 0xf7000020 0x24 0x0 0
R 2 298.823788 1 0xf7000024 0x25 0x0 0
R 4 298.823790 1 0xf7000024 0x26 0x0 0
R 2 298.823796 1 0xf7000024 0x27 0x0 0
R 2 298.823798 1 0xf7000024 0x28 0x0 0
W 2 298.823649 1 0xf7000000 0x0 0x0 0
W 2 298.823655 1 0xf7000000 0x0 0x0 0
W 2 298.823657 1 0xf7000000 0x0 0x0 0
W 2 298.823663 1 0xf7000000 0x0 0x0 0
W 2 298.823665 1 0xf7000004 0x5 0x0 0
W 2 298.823671 1 0xf7000004 0x6 0x0 0
W 2 298.823673 1 0xf7000004 0x7 0x0 0
W 4 298.823676 1 0xf7000004 0x8 0x0 0
W 2 298.823678 1 0xf7000008 0x9 0x0 0
W 2 298.823684 1 0xf7000008 0xA 0x0 0
W 2 298.823686 1 0xf7000008 0xB 0x0 0
W 2 298.823692 1 0xf7000008 0xC 0x0 0
W 2 298.823694 1 0xf700000C 0xD 0x0 0
W 2 298.823697 1 0xf700000C 0xE 0x0 0
W 2 298.823702 1 0xf700000C 0xF 0x0 0
W 2 298.823705 1 0xf700000C 0x10 0x0 0
W 2 298.823707 1 0xf7000010 0x11 0x0 0
W 2 298.823713 1 0xf7000010 0x12 0x0 0
W 4 298.823715 1 0xf7000010 0x13 0x0 0
W 2 298.823718 1 0xf7000010 0x14 0x0 0
W 2 298.823724 1 0xf7000014 0x15 0x0 0
W 2 298.823726 1 0xf7000014 0x16 0x0 0
W 2 298.823732 1 0xf7000014 0x17 0x0 0
W 2 298.823734 1 0xf7000014 0x18 0x0 0
W 2 298.823740 1 0xf7000018 0x19 0x0 0
W 4 298.823742 1 0xf7000018 0x1A 0x0 0
W 2 298.823748 1 0xf7000018 0x1B 0x0 0
W 2 298.823750 1 0xf7000018 0x1C 0x0 0
W 2 298.823756 1 0xf700001C 0x1D 0x0 0
W 4 298.823758 1 0xf700001C 0x1E 0x0 0
W 2 298.823764 1 0xf700001C 0x1F 0x0 0
W 2 298.823766 1 0xf700001C 0x20 0x0 0
W 2 298.823772 1 0xf7000020 0x21 0x0 0
W 4 298.823774 1 0xf7000020 0x22 0x0 0
W 2 298.823780 1 0xf7000020 0x23 0x0 0
W 2 298.823782 1 0xf7000020 0x24 0x0 0
W 2 298.823788 1 0xf7000024 0x25 0x0 0
W 4 298.823790 1 0xf7000024 0x26 0x0 0
W 2 298.823796 1 0xf7000024 0x27 0x0 0
W 2 298.823798 1 0xf7000024 0x28 0x0 0
W 2 298.823705 2 0xf7000030 0xFFFFFFFF 0x0 0
W 2 298.823707 2 0xf7000031 0xEFFFFFFF 0x0 0
W 2 298.823713 2 0xf7000032 0xDFFFFFFF 0x0 0
W 4 298.823715 2 0xf7000033 0xCFFFFFFF 0x0 0
W 2 298.823718 2 0xf7000034 0xBFFFFFFF 0x0 0
W 2 298.823724 2 0xf7000035 0xAFFFFFFF 0x0 0
W 2 298.823726 2 0xf7000036 0x9FFFFFFF 0x0 0
W 2 298.823732 2 0xf7000037 0x8FFFFFFF 0x0 0
W 2 298.823734 2 0xf7000038 0x7FFFFFFF 0x0 0
W 2 298.823740 2 0xf7000039 0x6FFFFFFF 0x0 0
W 4 298.823742 2 0xf700003A 0x5FFFFFFF 0x0 0
W 2 298.823748 2 0xf700003B 0x4FFFFFFF 0x0 0
W 2 298.823750 2 0xf700003C 0x3FFFFFFF 0x0 0
W 2 298.823756 2 0xf700003D 0x2FFFFFFF 0x0 0
W 4 298.823758 2 0xf700003E 0x1FFFFFFF 0x0 0
W 2 298.823764 2 0xf700003F 0x0FFFFFFF 0x0 0
W 2 298.823766 2 0xf7000040 0x0EFFFFFF 0x0 0
W 2 298.823772 2 0xf7000041 0x0DFFFFFF 0x0 0
W 4 298.823774 2 0xf7000042 0x0CFFFFFF 0x0 0
W 2 298.823780 2 0xf7000043 0x0BFFFFFF 0x0 0
W 2 298.823782 2 0xf7000044 0x0AFFFFFF 0x0 0
W 2 298.823788 2 0xf7000045 0x09FFFFFF 0x0 0
W 4 298.823790 2 0xf7000046 0x08FFFFFF 0x0 0
W 2 298.823796 2 0xf7000047 0x07FFFFFF 0x0 0
W 2 298.823798 2 0xf7000048 0x06FFFFFF 0x0 0
W 2 298.823705 2 0xf7000049 0x05FFFFFF 0x0 0
W 2 298.823707 2 0xf700004A 0x04FFFFFF 0x0 0
W 2 298.823713 2 0xf700004B 0x03FFFFFF 0x0 0
W 4 298.823715 2 0xf700004C 0x02FFFFFF 0x0 0
W 2 298.823718 2 0xf700004D 0x01FFFFFF 0x0 0
W 2 298.823724 2 0xf700004E 0x00FFFFFF 0x0 0
